{
  "lead_id": "lead_001",
  "received_at": "2026-06-13T21:42:00-05:00",
  "channel": "voice",
  "after_hours": true,
  "lead": { "name": "Jessica Moreno", "phone": "+1-512-555-0822" },
  "summary": "After-hours inbound voice lead. Jessica is interested in porcelain veneers for the top front teeth ahead of her wedding in ~6 weeks, wants a natural look for photos, asked about financing, and stated she is ready to book a consult. High-value, hard-deadline, financing-ready — a hot lead.",
  "transcript": [
    { "speaker": "agent", "text": "Thank you for calling BrightSmile Aesthetics, this is Ava, our after-hours assistant. How can I help you tonight?", "ts": "00:00" },
    { "speaker": "lead", "text": "Hi! I'm interested in veneers. I have a wedding coming up in about six weeks and I wanted to know if it's even possible in time, and whether you offer financing.", "ts": "00:06" },
    { "speaker": "agent", "text": "Congratulations on the wedding! Veneers before then is absolutely doable — the process usually takes two to three visits over about three weeks. Are you thinking a full smile, around eight to ten teeth, or just the front few?", "ts": "00:15" },
    { "speaker": "lead", "text": "Probably the top front ones, however many show when I smile. I want it to look really natural for the photos.", "ts": "00:27" },
    { "speaker": "agent", "text": "Perfect, that's exactly what we specialize in. And on financing — we offer 0% APR for 18 months on cosmetic treatment, so you can spread it out. Would mornings or afternoons work better for a consult this week?", "ts": "00:36" },
    { "speaker": "lead", "text": "Oh that's great. Afternoons are better for me. Honestly if it can be done in time I'm ready to book a consult.", "ts": "00:49" }
  ],
  "extracted": {
    "service_interest": ["Porcelain Veneers"],
    "timeline": "wedding in ~6 weeks",
    "deadline_weeks": 6,
    "urgency": "high",
    "financing_interest": true,
    "budget_signal": "value_seeking",
    "insurance_mentioned": false,
    "decision_stage": "ready_to_book"
  },
  "score": {
    "label": "hot",
    "value": 92,
    "confidence": 0.91,
    "reason_tags": ["flagship-high-value", "hard-deadline-6wk", "financing-ready", "ready-to-book", "after-hours-recovered"],
    "urgency_reasoning": "Hard event deadline in 6 weeks on a flagship cosmetic service, with the caller explicitly ready to book — every hour of delay risks losing a multi-thousand-dollar case to a competitor."
  },
  "estimated_deal_value": {
    "currency": "USD",
    "low": 7200,
    "high": 16000,
    "basis": "6-8 porcelain veneers @ $1,200-$2,000 per tooth"
  },
  "clinic_context_hits": [
    { "label": "Service offered", "value": "Porcelain Veneers — flagship cosmetic service", "source": "services", "matched": true },
    { "label": "Lead time", "value": "~3 weeks (2-3 visits) — fits a 6-week deadline", "source": "services", "matched": true },
    { "label": "Financing", "value": "CareCredit/Cherry, 0% APR 18 months on cosmetic over $2,000", "source": "financing_policy", "matched": true },
    { "label": "Insurance", "value": "Cosmetic not covered — financing is the affordability path", "source": "insurance_policy", "matched": true },
    { "label": "Premium lead rule", "value": "Hard deadline <8wk + flagship service + financing intent = HOT", "source": "premium_lead_rules", "matched": true },
    { "label": "Escalation policy", "value": "Hot -> alert front-desk + callback within 30 min", "source": "premium_lead_rules", "matched": true }
  ],
  "actions": [
    { "type": "extract", "label": "Extracted 8 qualification slots from transcript", "status": "done", "ts": "00:50" },
    { "type": "context_check", "label": "Consulted BrightSmile policy: services, financing, premium-lead rules", "status": "done", "ts": "00:50" },
    { "type": "score", "label": "Scored lead HOT (92/100, conf 0.91)", "status": "done", "ts": "00:51" },
    { "type": "notify", "label": "Posted hot-lead alert to Discord #front-desk", "status": "done", "ts": "00:51" },
    { "type": "draft_followup", "label": "Drafted concierge follow-up message", "status": "done", "ts": "00:51" },
    { "type": "create_task", "label": "Created callback reminder: within 30 minutes", "status": "pending", "ts": "00:51" }
  ],
  "next_best_action": {
    "recommendation": "Call Jessica back within 30 minutes tonight. Lead with: yes, it can be done in time. Offer the earliest afternoon consult this week and mention 0% financing as a convenience. Hold a Saturday slot as backup.",
    "draft_followup": "Hi Jessica! It's Ava from BrightSmile Aesthetics — congratulations again on the wedding! Great news: a natural-looking veneer smile is absolutely achievable in your 6-week window. I'd love to get you in for a consult this week — I have afternoon openings Wednesday and Thursday. And to keep it easy, cosmetic treatment can be spread over 18 months at 0% APR. Want me to hold Thursday at 2:00pm for you? — The BrightSmile Aesthetics Team",
    "channel": "call"
  },
  "notification": {
    "platform": "discord",
    "sent": true,
    "preview_markdown": "🔥 **HOT LEAD — after hours** • BrightSmile Aesthetics\n**Jessica Moreno** · 📞 +1-512-555-0822\n**Wants:** Porcelain Veneers (top front) · **Deadline:** wedding in 6 weeks\n**Score:** HOT 92/100 (conf 0.91) · **Est. value:** $7,200–$16,000\n**Why:** flagship service · hard 6-week deadline · financing-ready · said *“ready to book”*\n**Next best action:** Call back within 30 min, offer afternoon consult, lead with 0% financing.\n_Caught after-hours by the Local Voice Lead Closer — staff would have missed this call._"
  },
  "system_status": [
    { "component": "PersonaPlex (voice)", "status": "mock", "detail": "pre-recorded transcript fixture" },
    { "component": "Qwen via Hermes (scoring)", "status": "mock", "detail": "golden fixture — flip INFERENCE_BACKEND=hermes for GB10 Qwen" },
    { "component": "Hermes (orchestration)", "status": "online", "detail": "FastAPI in-process" },
    { "component": "Discord (alerts)", "status": "mock", "detail": "preview only — set DISCORD_WEBHOOK_URL to go live" }
  ]
}
